{
  "quoteRef": "1526549434",
  "receiptId": "123e4567-e89b-12d3-a456-426614174000",
  "preferredDepartureDate": "2020-07-01",
  "additionalInformation": "1 MEDIC. PLEASE CONTACT US AT  0330 726 2222 WHENEVER A REMOVAL IS NOT GOING AHEAD",
  "alternativeDate1": "2020-07-02",
  "alternativeDate2": "2020-07-05"
}